{
  "$schema": "../schemas/next-binding-ir.schema.json",
  "protocol": "nextjshx.next-binding-ir",
  "version": 1,
  "generatedBy": {
    "script": "scripts/bindings/sync-next-bindings.mjs",
    "typescriptVersion": "6.0.2"
  },
  "sources": {
    "allowlist": "config/next-public-entrypoints.json",
    "surface": "surface/next-public-surface.json",
    "overrides": "config/next-binding-overrides.json",
    "implementations": "config/next-binding-implementations.json"
  },
  "packages": {
    "next": {
      "name": "next",
      "version": "16.2.12"
    },
    "typescript": {
      "importName": "typescript",
      "name": "@typescript/typescript6",
      "version": "6.0.2"
    }
  },
  "surfaceHash": "sha256:2789fe465e2502593c4e1e2b8827ce1a1a718d9cfe8fb09e8c405b70629e233c",
  "exports": [
    {
      "module": "globalThis",
      "name": "Request",
      "priority": "P0",
      "kind": "type",
      "stability": "stable",
      "signatureHash": "sha256:9a6d3e7cfa0dc7e2b6bdb8856ed88375ae5f1b925c96d38ff8a2be5a4cb40895",
      "haxeTypePath": "nextjs.raw.server.WebRequest",
      "exposure": "raw-only",
      "fixture": "tests/next-surface/fixtures.json#p0-web-contracts",
      "declarations": [
        {
          "package": "@typescript/typescript6",
          "path": "lib/lib.dom.d.ts",
          "syntaxKind": "InterfaceDeclaration",
          "declaredName": "Request",
          "declarationHash": "sha256:061071c3d508f19893ab9fd7b1c714ca831aebfa41d11346aa15505f77dca0b1",
          "documentationHash": "sha256:e887b953a6a4f1f5881edf1e7afe679fb135a73c4dd747579d89782556919485",
          "normalizedText": "interface Request extends Body {\n    readonly cache: RequestCache;\n    readonly credentials: RequestCredentials;\n    readonly destination: RequestDestination;\n    readonly headers: Headers;\n    readonly integrity: string;\n    readonly keepalive: boolean;\n    readonly method: string;\n    readonly mode: RequestMode;\n    readonly redirect: RequestRedirect;\n    readonly referrer: string;\n    readonly referrerPolicy: ReferrerPolicy;\n    readonly signal: AbortSignal;\n    readonly url: string;\n    clone(): Request;\n}",
          "typeConstructs": [
            "BooleanKeyword",
            "ExpressionWithTypeArguments",
            "StringKeyword",
            "TypeReference"
          ],
          "internal": false
        },
        {
          "package": "@typescript/typescript6",
          "path": "lib/lib.dom.d.ts",
          "syntaxKind": "VariableDeclaration",
          "declaredName": "Request",
          "declarationHash": "sha256:89276c973442422345a154d8bc95977a68676f9227cb65a87c1409ed1a194382",
          "documentationHash": "sha256:e3b0c44298fc1c149afbf4c8996fb92427ae41e4649b934ca495991b7852b855",
          "normalizedText": "Request: {\n    prototype: Request;\n    new (input: RequestInfo | URL, init?: RequestInit): Request;\n}",
          "typeConstructs": [
            "TypeLiteral",
            "TypeReference",
            "UnionType"
          ],
          "internal": false
        }
      ],
      "safety": {
        "anyOccurrences": 0,
        "unknownOccurrences": 0,
        "appliedOverrides": []
      },
      "generation": {
        "status": "curated",
        "implementation": "b05-web-contracts",
        "strategy": "curated-public-type-projection",
        "owningBead": "nxhx-f34.3.5",
        "fixture": "tests/next-server"
      }
    },
    {
      "module": "globalThis",
      "name": "Response",
      "priority": "P0",
      "kind": "type",
      "stability": "stable",
      "signatureHash": "sha256:b032b8c503cb18ece8277fee78c79f679c2db056db976cb43ede64aecb318d12",
      "haxeTypePath": "nextjs.raw.server.WebResponse",
      "exposure": "raw-only",
      "fixture": "tests/next-surface/fixtures.json#p0-web-contracts",
      "declarations": [
        {
          "package": "@typescript/typescript6",
          "path": "lib/lib.dom.d.ts",
          "syntaxKind": "InterfaceDeclaration",
          "declaredName": "Response",
          "declarationHash": "sha256:d0845799f16b238fb2ff6580c92a31de35db43b76428da3a1e58b8fa5818d065",
          "documentationHash": "sha256:39ecd8dba5027d58016d2b2e52c549be873c70a9198e3b2c6dea7a0cc1288160",
          "normalizedText": "interface Response extends Body {\n    readonly headers: Headers;\n    readonly ok: boolean;\n    readonly redirected: boolean;\n    readonly status: number;\n    readonly statusText: string;\n    readonly type: ResponseType;\n    readonly url: string;\n    clone(): Response;\n}",
          "typeConstructs": [
            "BooleanKeyword",
            "ExpressionWithTypeArguments",
            "NumberKeyword",
            "StringKeyword",
            "TypeReference"
          ],
          "internal": false
        },
        {
          "package": "@typescript/typescript6",
          "path": "lib/lib.dom.d.ts",
          "syntaxKind": "VariableDeclaration",
          "declaredName": "Response",
          "declarationHash": "sha256:8100d6e15ded6e82db148893f4aecc2f089537579787f7a1454d62f4858a3c83",
          "documentationHash": "sha256:e3b0c44298fc1c149afbf4c8996fb92427ae41e4649b934ca495991b7852b855",
          "normalizedText": "Response: {\n    prototype: Response;\n    new (body?: BodyInit | null, init?: ResponseInit): Response;\n    error(): Response;\n    json(data: any, init?: ResponseInit): Response;\n    redirect(url: string | URL, status?: number): Response;\n}",
          "typeConstructs": [
            "AnyKeyword",
            "LiteralType",
            "NumberKeyword",
            "StringKeyword",
            "TypeLiteral",
            "TypeReference",
            "UnionType"
          ],
          "internal": false
        }
      ],
      "safety": {
        "anyOccurrences": 1,
        "unknownOccurrences": 0,
        "appliedOverrides": [
          {
            "id": "dom-response-any",
            "action": "map-any-to-genes-unknown",
            "occurrences": 1,
            "target": "genes.ts.Unknown",
            "owningBead": "nxhx-f34.3.5"
          }
        ]
      },
      "generation": {
        "status": "curated",
        "implementation": "b05-web-contracts",
        "strategy": "curated-public-type-projection",
        "owningBead": "nxhx-f34.3.5",
        "fixture": "tests/next-server"
      }
    },
    {
      "module": "next",
      "name": "Metadata",
      "priority": "P0",
      "kind": "type",
      "stability": "stable",
      "signatureHash": "sha256:2f0bf8024c0199975df23772a4a4fc4dc58f4d3c6e2ea65b5825336f460a175b",
      "haxeTypePath": "nextjs.raw.metadata.Metadata",
      "exposure": "raw-and-semantic",
      "fixture": "tests/next-surface/fixtures.json#p0-core-types",
      "declarations": [
        {
          "package": "next",
          "path": "dist/lib/metadata/types/metadata-interface.d.ts",
          "syntaxKind": "InterfaceDeclaration",
          "declaredName": "Metadata",
          "declarationHash": "sha256:79a10deb8c5d7f711e579fbb2b85caa02f234dbdd41143daaa5bba84749b732c",
          "documentationHash": "sha256:1e014037653dc67cebf64b4537262d3278c850da122f8c111f1e873bb4f83846",
          "normalizedText": "interface Metadata extends DeprecatedMetadataFields {\n    metadataBase?: null | string | URL | undefined;\n    title?: null | string | TemplateString | undefined;\n    description?: null | string | undefined;\n    applicationName?: null | string | undefined;\n    authors?: null | Author | Array<Author> | undefined;\n    generator?: null | string | undefined;\n    keywords?: null | string | Array<string> | undefined;\n    referrer?: null | ReferrerEnum | undefined;\n    themeColor?: null | string | ThemeColorDescriptor | ThemeColorDescriptor[] | undefined;\n    colorScheme?: null | ColorSchemeEnum | undefined;\n    viewport?: null | string | ViewportLayout | undefined;\n    creator?: null | string | undefined;\n    publisher?: null | string | undefined;\n    robots?: null | string | Robots | undefined;\n    alternates?: null | AlternateURLs | undefined;\n    icons?: null | IconURL | Array<Icon> | Icons | undefined;\n    manifest?: null | string | URL | undefined;\n    openGraph?: null | OpenGraph | undefined;\n    twitter?: null | Twitter | undefined;\n    facebook?: null | Facebook | undefined;\n    pinterest?: null | Pinterest;\n    verification?: Verification | undefined;\n    appleWebApp?: null | boolean | AppleWebApp | undefined;\n    formatDetection?: null | FormatDetection | undefined;\n    itunes?: null | ItunesApp | undefined;\n    abstract?: null | string | undefined;\n    appLinks?: null | AppLinks | undefined;\n    archives?: null | string | Array<string> | undefined;\n    assets?: null | string | Array<string> | undefined;\n    bookmarks?: null | string | Array<string> | undefined;\n    pagination?: {\n        previous?: null | string | URL | undefined;\n        next?: null | string | URL | undefined;\n    };\n    category?: null | string | undefined;\n    classification?: null | string | undefined;\n    other?: {\n        [name: string]: string | number | Array<string | number>;\n    } | undefined;\n}",
          "typeConstructs": [
            "ArrayType",
            "BooleanKeyword",
            "ExpressionWithTypeArguments",
            "LiteralType",
            "NumberKeyword",
            "StringKeyword",
            "TypeLiteral",
            "TypeReference",
            "UndefinedKeyword",
            "UnionType"
          ],
          "internal": true
        }
      ],
      "safety": {
        "anyOccurrences": 0,
        "unknownOccurrences": 0,
        "appliedOverrides": []
      },
      "generation": {
        "status": "curated",
        "implementation": "b03-core-root-types",
        "strategy": "curated-public-type-projection",
        "owningBead": "nxhx-f34.3.3",
        "fixture": "tests/next-core-navigation"
      }
    },
    {
      "module": "next",
      "name": "NextConfig",
      "priority": "P0",